{
  "$schema": "https://example.invalid/ai-migration-framework/schemas/plan.schema.json",
  "schema_version": "2.0",
  "id": "SLICE-0001",
  "status": "approved",
  "source_units": ["SRC-0001", "SRC-0003"],
  "behavioral_contracts": ["BEH-0001"],
  "target_units": ["TGT-0001", "TGT-0002", "TGT-0003"],
  "dependencies": [],
  "release_boundary": "Catalog writes route independently through the catalog capability toggle.",
  "rollback": "Disable catalog-java route and replay no data because dual-write remains enabled until approval.",
  "verification_gates": ["behavioral-contracts", "build", "tests", "architecture", "dependency-integrity"],
  "approval_refs": ["migration-owner-review-2026-01-01-slice-0001"]
}
